{
	"$schema": "http://json-schema.org/draft-07/schema#",
	"title": "Kreuzberg E2E Fixture",
	"description": "Defines a single end-to-end extraction scenario shared across language bindings.",
	"type": "object",
	"required": ["id", "description"],
	"properties": {
		"id": {
			"type": "string",
			"pattern": "^[a-z0-9_]+$",
			"description": "Stable identifier used by generators and test names."
		},
		"tags": {
			"type": "array",
			"items": {
				"type": "string"
			},
			"description": "Optional classification tags (e.g., pdf, ocr, regression)."
		},
		"description": {
			"type": "string"
		},
		"category": {
			"type": "string",
			"description": "Fixture category used for grouping generated tests (e.g., pdf, office)."
		},
		"document": {
			"type": "object",
			"required": ["path"],
			"properties": {
				"path": {
					"type": "string",
					"description": "Path to input document relative to test_documents/."
				},
				"media_type": {
					"type": "string",
					"description": "Expected MIME type for the source file."
				},
				"requires_external_tool": {
					"type": "array",
					"items": {
						"type": "string"
					},
					"description": "Optional external dependencies (e.g., tesseract)."
				}
			}
		},
		"extraction": {
			"type": "object",
			"properties": {
				"config": {
					"type": "object",
					"description": "ExtractionConfig overrides encoded as JSON (merged with default config)."
				},
				"force_async": {
					"type": "boolean",
					"description": "Request async API usage when true."
				},
				"chunking": {
					"type": "object",
					"description": "Chunking-specific expectations (e.g., chunk count thresholds)."
				},
				"method": {
					"type": "string",
					"enum": ["sync", "async", "batch_sync", "batch_async"],
					"default": "sync",
					"description": "Extraction method to use (sync/async, single/batch)."
				},
				"input_type": {
					"type": "string",
					"enum": ["file", "bytes"],
					"default": "file",
					"description": "Input type for extraction (file path or bytes)."
				}
			},
			"additionalProperties": false
		},
		"assertions": {
			"type": "object",
			"properties": {
				"expected_mime": {
					"oneOf": [
						{
							"type": "string"
						},
						{
							"type": "array",
							"items": {
								"type": "string"
							}
						}
					]
				},
				"min_content_length": {
					"type": "integer",
					"minimum": 0
				},
				"max_content_length": {
					"type": "integer",
					"minimum": 0
				},
				"content_contains_any": {
					"type": "array",
					"items": {
						"type": "string"
					}
				},
				"content_contains_all": {
					"type": "array",
					"items": {
						"type": "string"
					}
				},
				"content_not_empty": {
					"type": "boolean",
					"description": "Assert that extracted content is non-empty after trimming whitespace."
				},
				"tables": {
					"type": "object",
					"properties": {
						"min": {
							"type": "integer",
							"minimum": 0
						},
						"max": {
							"type": "integer",
							"minimum": 0
						},
						"has_bounding_boxes": {
							"type": "boolean",
							"description": "Assert that tables have bounding boxes populated."
						},
						"content_contains_any": {
							"type": "array",
							"items": {
								"type": "string"
							},
							"description": "Assert any table cell contains one of these strings."
						}
					},
					"additionalProperties": false
				},
				"detected_languages": {
					"type": "object",
					"properties": {
						"expects": {
							"type": "array",
							"items": {
								"type": "string"
							}
						},
						"min_confidence": {
							"type": "number",
							"minimum": 0,
							"maximum": 1
						}
					},
					"additionalProperties": false
				},
				"metadata": {
					"type": "object",
					"description": "Metadata assertions keyed by metadata path (e.g., pdf.page_count >= 1)."
				},
				"chunks": {
					"type": "object",
					"properties": {
						"min_count": {
							"type": "integer",
							"minimum": 0
						},
						"max_count": {
							"type": "integer",
							"minimum": 0
						},
						"each_has_content": {
							"type": "boolean"
						},
						"each_has_embedding": {
							"type": "boolean"
						},
						"each_has_heading_context": {
							"type": "boolean",
							"description": "Assert each chunk has heading_context populated (markdown chunker only)."
						},
						"each_has_chunk_type": {
							"type": "boolean",
							"description": "Assert each chunk has a specific (non-Unknown) chunk_type classification."
						},
						"content_starts_with_heading": {
							"type": "boolean",
							"description": "Assert each chunk's content starts with a Markdown heading (#)."
						}
					},
					"additionalProperties": false
				},
				"images": {
					"type": "object",
					"properties": {
						"min_count": {
							"type": "integer",
							"minimum": 0
						},
						"max_count": {
							"type": "integer",
							"minimum": 0
						},
						"formats_include": {
							"type": "array",
							"items": {
								"type": "string"
							}
						},
						"has_bounding_boxes": {
							"type": "boolean",
							"description": "Assert that images have bounding boxes populated."
						}
					},
					"additionalProperties": false
				},
				"pages": {
					"type": "object",
					"properties": {
						"min_count": {
							"type": "integer",
							"minimum": 0
						},
						"exact_count": {
							"type": "integer",
							"minimum": 0
						}
					},
					"additionalProperties": false
				},
				"elements": {
					"type": "object",
					"properties": {
						"min_count": {
							"type": "integer",
							"minimum": 0
						},
						"types_include": {
							"type": "array",
							"items": {
								"type": "string"
							}
						}
					},
					"additionalProperties": false
				},
				"ocr_elements": {
					"type": "object",
					"properties": {
						"has_elements": {
							"type": "boolean",
							"description": "Whether OCR elements should be present."
						},
						"elements_have_geometry": {
							"type": "boolean",
							"description": "Whether OCR elements should have bounding box geometry."
						},
						"elements_have_confidence": {
							"type": "boolean",
							"description": "Whether OCR elements should have confidence scores."
						},
						"min_count": {
							"type": "integer",
							"minimum": 0
						}
					},
					"additionalProperties": false
				},
				"document": {
					"type": "object",
					"properties": {
						"has_document": {
							"type": "boolean",
							"description": "Whether a document structure tree should be present."
						},
						"min_node_count": {
							"type": "integer",
							"minimum": 0
						},
						"node_types_include": {
							"type": "array",
							"items": {
								"type": "string"
							},
							"description": "Node types that must be present in the document tree."
						},
						"has_groups": {
							"type": "boolean",
							"description": "Whether group nodes must be present."
						}
					},
					"additionalProperties": false
				},
				"keywords": {
					"type": "object",
					"properties": {
						"has_keywords": {
							"type": "boolean",
							"description": "Whether keywords should be present."
						},
						"min_count": {
							"type": "integer",
							"minimum": 0
						},
						"max_count": {
							"type": "integer",
							"minimum": 0
						}
					},
					"additionalProperties": false
				},
				"quality_score": {
					"type": "object",
					"properties": {
						"has_score": {
							"type": "boolean",
							"description": "Whether quality_score should be present."
						},
						"min_score": {
							"type": "number",
							"minimum": 0,
							"maximum": 1
						},
						"max_score": {
							"type": "number",
							"minimum": 0,
							"maximum": 1
						}
					},
					"additionalProperties": false
				},
				"processing_warnings": {
					"type": "object",
					"properties": {
						"max_count": {
							"type": "integer",
							"minimum": 0
						},
						"is_empty": {
							"type": "boolean",
							"description": "Whether processing_warnings should be empty."
						}
					},
					"additionalProperties": false
				},
				"djot_content": {
					"type": "object",
					"properties": {
						"has_content": {
							"type": "boolean",
							"description": "Whether djot_content should be present."
						},
						"min_blocks": {
							"type": "integer",
							"minimum": 0
						}
					},
					"additionalProperties": false
				},
				"output_format_is": {
					"type": "string",
					"enum": ["plain", "markdown", "html", "djot", "structured"],
					"description": "Assert that the output format matches expected value."
				},
				"result_format_is": {
					"type": "string",
					"enum": ["unified", "element_based"],
					"description": "Assert that the result format matches expected value."
				}
			},
			"additionalProperties": false
		},
		"skip": {
			"type": "object",
			"properties": {
				"if_document_missing": {
					"type": "boolean",
					"default": true
				},
				"requires_feature": {
					"type": "array",
					"items": {
						"type": "string"
					}
				},
				"notes": {
					"type": "string"
				}
			},
			"additionalProperties": false
		},
		"api_category": {
			"type": "string",
			"description": "Plugin API category for plugin API fixtures."
		},
		"api_function": {
			"type": "string",
			"description": "Plugin API function name."
		},
		"test_spec": {
			"type": "object",
			"description": "Full test specification for plugin API fixtures."
		},
		"plugin_skip": {
			"type": "object",
			"description": "Per-language skip directives for plugin API fixtures."
		}
	},
	"additionalProperties": false
}
